"Key","Item Type","Publication Year","Author","Title","Publication Title","ISBN","ISSN","DOI","Url","Abstract Note","Date","Date Added","Date Modified","Access Date","Pages","Num Pages","Issue","Volume","Number Of Volumes","Journal Abbreviation","Short Title","Series","Series Number","Series Text","Series Title","Publisher","Place","Language","Rights","Type","Archive","Archive Location","Library Catalog","Call Number","Extra","Notes","File Attachments","Link Attachments","Manual Tags","Automatic Tags","Editor","Series Editor","Translator","Contributor","Attorney Agent","Book Author","Cast Member","Commenter","Composer","Cosponsor","Counsel","Interviewer","Producer","Recipient","Reviewed Author","Scriptwriter","Words By","Guest","Number","Edition","Running Time","Scale","Medium","Artwork Size","Filing Date","Application Number","Assignee","Issuing Authority","Country","Meeting Name","Conference Name","Court","References","Reporter","Legal Status","Priority Numbers","Programming Language","Version","System","Code","Code Number","Section","Session","Committee","History","Legislative Body"
"7MHQJU78","webpage","","","Citoyen hackeur","","","","","http://www.laviedesidees.fr/Citoyen-hackeur.html","Pour accroître la participation citoyenne et la réactivité politique, de nouvelles civic tech revendiquent aujourd'hui de « hacker » la démocratie. Au (...)","","2017-05-13 16:47:18","2017-05-13 16:47:18","2017-05-10 08:06:34","","","","","","","","","","","","","","","","","","","","","","","/Users/camilleruppli/Library/Application Support/Zotero/Profiles/bce4a9hx.default/zotero/storage/QACVRVSC/Citoyen hackeur.html","","","","","","","","","","","","","","","","","","","","","","","","","","","","","","","","","","","","","","","","","","","","","","","","",""
"3RIF8FXS","journalArticle","2016","","Comment le numérique change la politique","Le Monde.fr","","","","http://nouveau.europresse.com/Link/TELECOMT_1/news·20161222·LMF·5053079","","2016-12-22","2017-05-13 16:47:18","2017-05-13 16:47:18","","","","","","","","","","","","","","","","","","","","","","","","","","","","","","","","","","","","","","","","","","","","","","","","","","","","","","","","","","","","","","","","","","","","","","","","",""
"4KZHISAG","webpage","","Center for History and New Media","Guide rapide pour débuter","","","","","http://zotero.org/support/quick_start_guide","","","2017-05-13 16:47:18","2017-05-13 16:47:18","","","","","","","","","","","","","","","","","","","","","","","","","","","","","","","","","","","","","","","","","","","","","","","","","","","","","","","","","","","","","","","","","","","","","","","","",""
"WTF687E3","blogPost","2016","Chaput, Valentin","La civic-tech française risque de se détourner de la création des biens communs numériques","Medium","","","","https://medium.com/open-source-politics/la-civic-tech-fran%C3%A7aise-risque-de-se-d%C3%A9tourner-de-la-cr%C3%A9ation-des-biens-communs-num%C3%A9riques-dont-9ebcf5c55c2e#.mara24q2h","#civictech #OGP16 — lancement du rapport de point d’aencrage","2016-12-06","2017-05-13 16:47:18","2017-05-13 16:47:18","2017-05-10 09:07:53","","","","","","","","","","","","","","","","","","","","","","","/Users/camilleruppli/Library/Application Support/Zotero/Profiles/bce4a9hx.default/zotero/storage/VSM6G34W/Chaput - 2016 - La civic-tech française risque de se détourner de .html","","","","","","","","","","","","","","","","","","","","","","","","","","","","","","","","","","","","","","","","","","","","","","","","",""
"P34ZB3EX","blogPost","","","L'ADN de #MAVOIX","#MAVOIX","","","","https://www.mavoix.info/comprendre/qui-sommes-nous/","L'ADN de #MAVOIX","","2017-05-13 16:47:18","2017-05-13 16:47:18","2017-05-10 09:01:22","","","","","","","","","","","","","","","","","","","","","","","/Users/camilleruppli/Library/Application Support/Zotero/Profiles/bce4a9hx.default/zotero/storage/9Z2CKDEU/L'ADN de #MAVOIX.html","","","","","","","","","","","","","","","","","","","","","","","","","","","","","","","","","","","","","","","","","","","","","","","","",""
"A93XPEW4","journalArticle","2016","Merchier, Maurice","Vers la transdémocratie ?","Le Débat","","0246-2346","","http://www.cairn.info/resume.php?ID_ARTICLE=DEBA_192_0055","","2016-12-05","2017-05-13 16:47:18","2017-05-13 16:47:18","2017-05-09 15:11:25","55-66","","192","","","","","","","","","","","fr","","","","","Cairn.info","","","","/Users/camilleruppli/Library/Application Support/Zotero/Profiles/bce4a9hx.default/zotero/storage/P3WBBDGB/Merchier - 2016 - Vers la transdémocratie .html","","","","","","","","","","","","","","","","","","","","","","","","","","","","","","","","","","","","","","","","","","","","","","","","",""
"ZGDTWJN6","book","","","Axelle Lemaire","","","","","http://nouveau.europresse.com/Link/TELECOMT_1/bio·SEP·140710","","","2017-05-23 06:49:09","2017-05-23 06:49:09","","","","","","","","","","","","","Acteurs Publics - Biographies","","","","","","","","","","","/Users/camilleruppli/Library/Application Support/Zotero/Profiles/bce4a9hx.default/zotero/storage/F4EUFAWV/Axelle Lemaire.html","","","","","","","","","","","","","","","","","","","","","","","","","","","","","","","","","","","","","","","","","","","","","","","","",""
"FGFDQMRZ","journalArticle","2017","","Civic Tech : « Après l'économie collaborative, voici la politique collaborative ! »","Le Monde.fr","","","","http://nouveau.europresse.com/Link/TELECOMT_1/news·20170421·LMF·5115043","","2017-04-21","2017-05-23 06:49:09","2017-05-23 06:49:09","","","","","","","","Civic Tech","","","","","","","","","","","","","","","","","","","","","","","","","","","","","","","","","","","","","","","","","","","","","","","","","","","","","","","","","","","","","","","","",""
"6F6MQSUU","journalArticle","2016","","La créativité démocratique et citoyenne au-delà de l'isoloir","Le Monde.fr","","","","http://nouveau.europresse.com/Link/TELECOMT_1/news·20161206·LMF·5044451","","2016-12-06","2017-05-23 06:49:09","2017-05-23 06:49:09","","","","","","","","","","","","","","","","","","","","","","","","","","","","","","","","","","","","","","","","","","","","","","","","","","","","","","","","","","","","","","","","","","","","","","","","",""
"A34BHW4C","webpage","","","Le débat CNDP et ses publics à l'épreuve du numérique","","","","","http://bibliotheque.utc.fr/EXPLOITATION/doc/IFD/2014COMP2148/le-debat-cndp-et-ses-publics-a-l-epreuve-du-numerique","L'objectif de cette thèse est d'étudier les débats publics tels qu'organisés par la Commission Nationale du Débat Public (CNDP), et plus particulièrement les usages du numérique pour venir   équiper   les dispositifs participatifs mis en place. Le travail mené en Sciences de l'information et de la Communication (SIC) interroge le rôle de la configuration des dispositifs de médiation dans la constitution des publics. Il s'agit d'observer comment les choix techniques effectués pour organiser la discussion contribuent à la sélection des publics, dans la mesure où ils leur permettent plus ou moins d'exprimer le lien qui les relie à l'objet du débat. Nous parlerons de leur   concernement   pour qualifier ce lien. Pour mener à bien notre enquête, nous avons mis en place une méthodologie originale de comparaison des espaces   en ligne   et   hors ligne  , mobilisée sur trois études de cas : le débat Ivry Paris-XIII sur la rénovation d'un incinérateur de déchets ménagers, celui sur le projet de Parc éolien en mer des Deux Côtes et enfin celui sur le projet CIGEO, le centre d'enfouissement des déchets nucléaires à Bure. L'enjeu de la thèse est de montrer qu'en fonction des situations, la méthodologie du débat public est plus ou moins mise à l'épreuve par l'objet débattu. Les usages du numérique diffèrent également : s'il est parfois porteur d espoirs d'inclusion de nouveaux publics dans le débat, il peut également être utilisé pour contourner l'expression de la critique sociale. Dans ces derniers cas, nous montrerons comment une forme de   gouvernementalité numérique   contribue à mettre à distance les critiques les plus radicales pour que le débat puisse se tenir, malgré tout.","","2017-05-23 06:49:09","2017-05-23 06:49:09","2017-05-19 11:45:09","","","","","","","","","","","","","","fr-FR","","","","","","","","","/Users/camilleruppli/Library/Application Support/Zotero/Profiles/bce4a9hx.default/zotero/storage/U57SIZDU/Le débat CNDP et ses publics à l'épreuve du numéri.html","","","","","","","","","","","","","","","","","","","","","","","","","","","","","","","","","","","","","","","","","","","","","","","","",""
"ZKJCBHNE","journalArticle","2016","","Les nouvelles ambitions de la « Civic Tech » française","Le Monde.fr","","","","http://nouveau.europresse.com/Link/TELECOMT_1/news·20161010·LMF·5010742","","2016-10-10","2017-05-23 06:49:09","2017-05-23 06:49:09","","","","","","","","","","","","","","","","","","","","","","","","","","","","","","","","","","","","","","","","","","","","","","","","","","","","","","","","","","","","","","","","","","","","","","","","",""
"SQVDA7JF","webpage","","","Mr Mondialisation","Tipeee","","","","https://www.tipeee.com/mr-mondialisation/embed/box","homepage_meta_description","","2017-05-23 06:49:09","2017-05-23 06:49:09","2017-05-19 11:31:03","","","","","","","","","","","","","","","","","","","","","","","/Users/camilleruppli/Library/Application Support/Zotero/Profiles/bce4a9hx.default/zotero/storage/MN9FU2K6/Mr Mondialisation.html","","","","","","","","","","","","","","","","","","","","","","","","","","","","","","","","","","","","","","","","","","","","","","","","",""
"AQDCGJAI","journalArticle","2016","Rolland, Sylvain","Paris accueille le premier incubateur pour les ""Civic Tech""","La Tribune (France)","","","","http://nouveau.europresse.com/Link/TELECOMT_1/news·20161207·TR·933458","","2016-12-07","2017-05-23 06:49:09","2017-05-23 06:49:09","","","","","","","","","","","","","","","","","","","","","","","","/Users/camilleruppli/Library/Application Support/Zotero/Profiles/bce4a9hx.default/zotero/storage/HMFPMUTE/Rolland - 2016 - Paris accueille le premier incubateur pour les Ci.html","","","","","","","","","","","","","","","","","","","","","","","","","","","","","","","","","","","","","","","","","","","","","","","","",""
"P8V4648V","journalArticle","2016","","Quel est le « potentiel des nouvelles technologies dans l'action publique » ?","Le Monde.fr","","","","http://nouveau.europresse.com/Link/TELECOMT_1/news·20161209·LMF·5046563","","2016-12-09","2017-05-23 06:49:09","2017-05-23 06:49:09","","","","","","","","","","","","","","","","","","","","","","","","","","","","","","","","","","","","","","","","","","","","","","","","","","","","","","","","","","","","","","","","","","","","","","","","",""
"ENNG7NKV","webpage","","","Regards Citoyens","RegardsCitoyens.org","","","","http://www.RegardsCitoyens.org","Transparence de la vie politique et Open Data","","2017-05-23 06:49:09","2017-05-23 06:49:09","2017-05-16 21:33:16","","","","","","","","","","","","","","","","","","","","","","","/Users/camilleruppli/Library/Application Support/Zotero/Profiles/bce4a9hx.default/zotero/storage/DUAXWRQH/Regards Citoyens.html","","","","","","","","","","","","","","","","","","","","","","","","","","","","","","","","","","","","","","","","","","","","","","","","",""